{
  "schema_version": "comparison_input_v0",
  "system": "baseline",
  "scenario_id": "SCENARIO_STRONG_001",
  "task_class": "bounded_router_trigger_fix",
  "closure_result": "ACCEPTED",
  "blocker_to_closure_cycles": 2,
  "false_success_risk": "HIGH",
  "proof_completeness": "LOW",
  "recovery_cost": "HIGH",
  "coordination_overhead": "LOW",
  "notes": "Small disciplined baseline likely feels cheap but remains exposed to narrative-only acceptance."
}
